{
  "schema_version": 1,
  "artifact_type": "mission_prepare_receipt",
  "repo_identity": "git-common-dir:/home/cookys/projects/autopilot/.git",
  "adoption_key": "2ee60fd0ace961ce9721bdaf968d91f7564e6ac801c889df8ab94ced613d77d4",
  "mission_lineage_id": "lineage-v1-2ee60fd0ace961ce9721bdaf968d91f7564e6ac801c889df8ab94ced613d77d4",
  "task_authority_id": "0ecd5a4fbf6f214731aba80d265fbc1d02223c16499ada7058656cefa0568dd8",
  "policy_hash": "78809e3845f5ebf1426050316ea8bede55edbf2364008dbad65bfca3b2645964",
  "intent_hash": "e2c86de4cd204352873833c94493c9a2da6c92f0046afe60a29491444f728cb8",
  "initial_required_acceptance_hashes": [
    "9af01f030b25766d9930016b6828c27d47bcaf417b67f43f08b8197efac3a8aa",
    "d3a11b8d43f7e03c0dc5df11fa3047cda8ed19664c6a8d5aba351f7634de75d6"
  ],
  "mission_policy_digest": "23373ee72afbff25f8be9b16f3bcd18e3e07a4b88e9f7071d282e54b8e84bdb9",
  "mission_graph_digest": "6e05fe9b2efe6af0645152b2d8335e246db998ca5a1f6184767125997bfffef8",
  "enforcement_mode": "enforce",
  "state_hash": "2029dab03b1ddf59d2f65f035048af02bc6a2940765cfd61861b05911a7e5374",
  "adopted": false,
  "prepared_at": "2026-09-15T04:00:47.277Z",
  "receipt_digest": "8a79f31d6bfe1e0748cbeabc5b11adbf652229def250cfeef7590818c4b13b6f"
}
